{
  "model_basename": "qwen38-flash-next-nvfp4-7b71922",
  "profile": "rtx5090-wsl2-256k-image",
  "schema_version": "1.0",
  "served_model_name": "qwen3.8-flash-next-nvfp4",
  "settings": {
    "attention_backend": "qsa_triton_sm120",
    "cache_type": "naive",
    "cuda_graph": false,
    "gpu_memory_envelope_bytes": 33285996544,
    "gpu_runtime_reserve_bytes": 536870912,
    "host": "127.0.0.1",
    "max_prefill_length": 512,
    "max_running_requests": 1,
    "max_seq_len": 262144,
    "memory_ratio": 0.89,
    "moe_backend": "offload",
    "moe_cache_auto": true,
    "moe_cpu_layers": null,
    "moe_prefill_sparse": true,
    "num_tokens": 262144,
    "nvfp4_backend": "auto",
    "ple_cache_bytes": 4294967296,
    "ple_io_backend": "io_uring_odirect",
    "ple_max_batch_pages": 4096,
    "ple_queue_depth": 512,
    "ple_require_native_io_uring": true,
    "ple_staging_buffers": 2,
    "port": 1919,
    "qsa_require_native_topk": true,
    "tp_size": 1,
    "vision_enabled": true
  }
}
